{
  "cluster_id": "ccc-syracuse-climate-plan",
  "slug": "syracuse-climate-plan",
  "public_title": "Mayor Owens Announces Adoption of Inaugural Climate Action Plan",
  "discussion_statement": "The City of Syracuse announced adoption of its first community and municipal climate action plan, covering resilience, energy, mobility, education, heat and flooding.",
  "date_first_observed": "2026-07-14",
  "date_most_recently_observed": "2026-07-14",
  "principal_source_id": "ccs-syracuse-climate-plan",
  "linked_source_ids": [],
  "primary_theme": "climate-governance-delivery",
  "secondary_themes": [],
  "geographies": [
    "global"
  ],
  "source_environments": [
    "policy-and-institutions"
  ],
  "principal_source_role": "official-announcement",
  "summary": "The City of Syracuse announced adoption of its first community and municipal climate action plan, covering resilience, energy, mobility, education, heat and flooding.",
  "reason_for_relevance": "The plan provides a current municipal example of translating climate goals into an implementation framework.",
  "limitations": "The announcement is outside the strict 30-day window and does not establish delivery performance.",
  "agreement_disagreement_uncertainty": "No source disagreement was established by the captured evidence.",
  "clustering": {
    "confidence": 1.0,
    "rationale": "Single-source cluster.",
    "method": "stable-link-and-event-identity",
    "version": "1.0.0",
    "supporting_identifiers": [
      "https://www.syr.gov/News/City-News/City-2026/2026-07-14-Mayors-Office-News-1130AM"
    ],
    "principal_source_rationale": "The original evidence or official source is principal; reporting, analysis and commentary remain separately attributed."
  },
  "ai_provenance": {
    "used": false,
    "model": null,
    "prompt_version": "current-conversations-classification-v1-fixture",
    "run_id": "gate-4b-5a-mixed-source-captured"
  },
  "publication_decision": "published",
  "correction_status": "none",
  "availability_status": "available",
  "history": [
    {
      "date": "2026-08-17",
      "action": "created",
      "note": "Created for private mixed-source calibration; identifiers remain stable."
    }
  ],
  "homepage_eligible": true,
  "archive_date": null,
  "captured_fixture": true
}
