{
  "cluster_id": "ccc-unep-extreme-heat-diplomacy",
  "slug": "unep-extreme-heat-diplomacy",
  "public_title": "Beating the Heat Together: City Diplomacy and the Global Mobilization against Extreme Heat",
  "discussion_statement": "UNEP's event page frames extreme heat as a topic for city diplomacy and shared urban learning among municipal and international actors.",
  "date_first_observed": "2026-08-03",
  "date_most_recently_observed": "2026-08-03",
  "principal_source_id": "ccs-unep-extreme-heat-diplomacy",
  "linked_source_ids": [],
  "primary_theme": "geographies-of-climate-learning",
  "secondary_themes": [
    "modes-of-climate-delivery"
  ],
  "geographies": [
    "global"
  ],
  "source_environments": [
    "policy-and-institutions"
  ],
  "principal_source_role": "official-announcement",
  "summary": "UNEP's event page frames extreme heat as a topic for city diplomacy and shared urban learning among municipal and international actors.",
  "reason_for_relevance": "It illustrates how cities exchange approaches and mobilize collective attention around climate risk.",
  "limitations": "An event page establishes the discussion agenda, not evidence of resulting policy change.",
  "agreement_disagreement_uncertainty": "No source disagreement was established by the captured evidence.",
  "clustering": {
    "confidence": 1.0,
    "rationale": "Single-source cluster.",
    "method": "stable-link-and-event-identity",
    "version": "1.0.0",
    "supporting_identifiers": [
      "https://www.unep.org/events/unep-event/beating-heat-together-city-diplomacy-and-global-mobilization-against-extreme-heat"
    ],
    "principal_source_rationale": "The original evidence or official source is principal; reporting, analysis and commentary remain separately attributed."
  },
  "ai_provenance": {
    "used": false,
    "model": null,
    "prompt_version": "current-conversations-classification-v1-fixture",
    "run_id": "thematic-reframe-mixed-source-captured"
  },
  "publication_decision": "published",
  "correction_status": "none",
  "availability_status": "available",
  "history": [
    {
      "date": "2026-08-17",
      "action": "created",
      "note": "Created for private mixed-source calibration; identifiers remain stable."
    }
  ],
  "homepage_eligible": true,
  "archive_date": null,
  "captured_fixture": true
}
