{
  "cluster_id": "ccc-era5-urban-biases",
  "slug": "era5-urban-biases",
  "public_title": "Evaluating ERA5-Land air temperature and dew point biases in built-up environments in the UK",
  "discussion_statement": "The study evaluates temperature and dew-point biases in ERA5-Land data across built-up UK environments and considers how those biases propagate into urban climate applications.",
  "date_first_observed": "2026-08-13",
  "date_most_recently_observed": "2026-08-13",
  "principal_source_id": "ccs-era5-urban-biases",
  "linked_source_ids": [],
  "primary_theme": "evidence-infrastructure-tools",
  "secondary_themes": [],
  "geographies": [
    "united-kingdom"
  ],
  "source_environments": [
    "academic-research"
  ],
  "principal_source_role": "primary-research",
  "summary": "The study evaluates temperature and dew-point biases in ERA5-Land data across built-up UK environments and considers how those biases propagate into urban climate applications.",
  "reason_for_relevance": "It shows how infrastructure-level data limitations can affect downstream urban climate decisions.",
  "limitations": "The summary uses the provider abstract and does not independently reproduce the validation.",
  "agreement_disagreement_uncertainty": "No source disagreement was established by the captured evidence.",
  "clustering": {
    "confidence": 1.0,
    "rationale": "Single-source cluster.",
    "method": "stable-link-and-event-identity",
    "version": "1.0.0",
    "supporting_identifiers": [
      "https://doi.org/10.1016/j.uclim.2026.103088"
    ],
    "principal_source_rationale": "The original evidence or official source is principal; reporting, analysis and commentary remain separately attributed."
  },
  "ai_provenance": {
    "used": false,
    "model": null,
    "prompt_version": "current-conversations-classification-v1-fixture",
    "run_id": "gate-4b-5a-mixed-source-captured"
  },
  "publication_decision": "published",
  "correction_status": "none",
  "availability_status": "available",
  "history": [
    {
      "date": "2026-08-17",
      "action": "created",
      "note": "Created for private mixed-source calibration; identifiers remain stable."
    }
  ],
  "homepage_eligible": true,
  "archive_date": null,
  "captured_fixture": false
}
