{
  "cluster_id": "ccc-data-portal-for-cities",
  "slug": "data-portal-for-cities",
  "public_title": "Data Portal for Cities",
  "discussion_statement": "The platform provides preliminary city emissions data and export functions intended to help local governments build inventories and set priorities.",
  "date_first_observed": "2026-08-01",
  "date_most_recently_observed": "2026-08-01",
  "principal_source_id": "ccs-data-portal-for-cities",
  "linked_source_ids": [],
  "primary_theme": "where-new-evidence-matters",
  "secondary_themes": [
    "modes-of-climate-delivery"
  ],
  "geographies": [
    "global"
  ],
  "source_environments": [
    "data-and-tools"
  ],
  "principal_source_role": "dataset-or-tool",
  "summary": "The platform provides preliminary city emissions data and export functions intended to help local governments build inventories and set priorities.",
  "reason_for_relevance": "It is an example of shared evidence infrastructure intended to fill local data gaps and support municipal reporting.",
  "limitations": "The page describes intended capabilities; coverage, uncertainty and decision impact were not independently assessed.",
  "agreement_disagreement_uncertainty": "No source disagreement was established by the captured evidence.",
  "clustering": {
    "confidence": 1.0,
    "rationale": "Single-source cluster.",
    "method": "stable-link-and-event-identity",
    "version": "1.0.0",
    "supporting_identifiers": [
      "https://dataportalforcities.org/"
    ],
    "principal_source_rationale": "The original evidence or official source is principal; reporting, analysis and commentary remain separately attributed."
  },
  "ai_provenance": {
    "used": false,
    "model": null,
    "prompt_version": "current-conversations-classification-v1-fixture",
    "run_id": "thematic-reframe-mixed-source-captured"
  },
  "publication_decision": "published",
  "correction_status": "none",
  "availability_status": "available",
  "history": [
    {
      "date": "2026-08-17",
      "action": "created",
      "note": "Created for private mixed-source calibration; identifiers remain stable."
    }
  ],
  "homepage_eligible": true,
  "archive_date": null,
  "captured_fixture": true
}
