{
  "cluster_id": "ccc-berkeley-synthesis-launch",
  "slug": "berkeley-synthesis-launch",
  "public_title": "From Observation to Decision: An Introduction to Synthesis by Berkeley Earth",
  "discussion_statement": "Berkeley Earth introduces a platform connecting historical observations with bias-corrected climate projections at local scale for cities and countries.",
  "date_first_observed": "2026-07-08",
  "date_most_recently_observed": "2026-07-08",
  "principal_source_id": "ccs-berkeley-synthesis-launch",
  "linked_source_ids": [],
  "primary_theme": "evidence-infrastructure-tools",
  "secondary_themes": [],
  "geographies": [
    "global"
  ],
  "source_environments": [
    "blogs-and-commentary"
  ],
  "principal_source_role": "research-commentary",
  "summary": "Berkeley Earth introduces a platform connecting historical observations with bias-corrected climate projections at local scale for cities and countries.",
  "reason_for_relevance": "The source makes explicit claims about moving from observation to decision, directly engaging the lab's interest in usable evidence infrastructure.",
  "limitations": "This is the developer's own description, outside the 30-day window, and not an independent evaluation.",
  "agreement_disagreement_uncertainty": "No source disagreement was established by the captured evidence.",
  "clustering": {
    "confidence": 1.0,
    "rationale": "Single-source cluster.",
    "method": "stable-link-and-event-identity",
    "version": "1.0.0",
    "supporting_identifiers": [
      "https://berkeleyearth.org/from-observation-to-decision-an-introduction-to-synthesis-by-berkeley-earth/"
    ],
    "principal_source_rationale": "The original evidence or official source is principal; reporting, analysis and commentary remain separately attributed."
  },
  "ai_provenance": {
    "used": false,
    "model": null,
    "prompt_version": "current-conversations-classification-v1-fixture",
    "run_id": "gate-4b-5a-mixed-source-captured"
  },
  "publication_decision": "published",
  "correction_status": "none",
  "availability_status": "available",
  "history": [
    {
      "date": "2026-08-17",
      "action": "created",
      "note": "Created for private mixed-source calibration; identifiers remain stable."
    }
  ],
  "homepage_eligible": true,
  "archive_date": null,
  "captured_fixture": true
}
