{
  "cluster_id": "ccc-urbclim-model",
  "slug": "urbclim-model",
  "public_title": "The UrbClim model",
  "discussion_statement": "The UrbClim site describes a city-scale climate model offering high-resolution outputs for heat and related variables across historical and future periods.",
  "date_first_observed": "2026-06-23",
  "date_most_recently_observed": "2026-06-23",
  "principal_source_id": "ccs-urbclim-model",
  "linked_source_ids": [],
  "primary_theme": "evidence-infrastructure-tools",
  "secondary_themes": [],
  "geographies": [
    "global"
  ],
  "source_environments": [
    "data-and-tools"
  ],
  "principal_source_role": "dataset-or-tool",
  "summary": "The UrbClim site describes a city-scale climate model offering high-resolution outputs for heat and related variables across historical and future periods.",
  "reason_for_relevance": "It raises questions about model validation, usability and how city-scale climate evidence enters planning decisions.",
  "limitations": "The developer description predates the pilot window; accuracy claims were not independently tested.",
  "agreement_disagreement_uncertainty": "No source disagreement was established by the captured evidence.",
  "clustering": {
    "confidence": 1.0,
    "rationale": "Single-source cluster.",
    "method": "stable-link-and-event-identity",
    "version": "1.0.0",
    "supporting_identifiers": [
      "https://www.urban-climate.eu/model"
    ],
    "principal_source_rationale": "The original evidence or official source is principal; reporting, analysis and commentary remain separately attributed."
  },
  "ai_provenance": {
    "used": false,
    "model": null,
    "prompt_version": "current-conversations-classification-v1-fixture",
    "run_id": "gate-4b-5a-mixed-source-captured"
  },
  "publication_decision": "published",
  "correction_status": "none",
  "availability_status": "available",
  "history": [
    {
      "date": "2026-08-17",
      "action": "created",
      "note": "Created for private mixed-source calibration; identifiers remain stable."
    }
  ],
  "homepage_eligible": true,
  "archive_date": null,
  "captured_fixture": true
}
