{
  "cluster_id": "ccc-local-temperature-records-tool",
  "slug": "local-temperature-records-tool",
  "public_title": "Local Records Data Viewer",
  "discussion_statement": "The viewer provides filterable daily temperature records for US cities using open data from NOAA regional climate centres.",
  "date_first_observed": "2026-07-27",
  "date_most_recently_observed": "2026-07-27",
  "principal_source_id": "ccs-climate-central-local-records",
  "linked_source_ids": [],
  "primary_theme": "where-new-evidence-matters",
  "secondary_themes": [],
  "geographies": [
    "global"
  ],
  "source_environments": [
    "data-and-tools"
  ],
  "principal_source_role": "dataset-or-tool",
  "summary": "The viewer provides filterable daily temperature records for US cities using open data from NOAA regional climate centres.",
  "reason_for_relevance": "It is a concrete example of an urban-facing data interface whose design and provenance shape evidence use.",
  "limitations": "Coverage is US-specific and the private pilot did not test usability or reproduce the underlying calculations.",
  "agreement_disagreement_uncertainty": "No source disagreement was established by the captured evidence.",
  "clustering": {
    "confidence": 1.0,
    "rationale": "Single-source cluster.",
    "method": "stable-link-and-event-identity",
    "version": "1.0.0",
    "supporting_identifiers": [
      "https://app.climatecentral.org/dataviz/local-records/data-viewer"
    ],
    "principal_source_rationale": "The original evidence or official source is principal; reporting, analysis and commentary remain separately attributed."
  },
  "ai_provenance": {
    "used": false,
    "model": null,
    "prompt_version": "current-conversations-classification-v1-fixture",
    "run_id": "thematic-reframe-mixed-source-captured"
  },
  "publication_decision": "published",
  "correction_status": "none",
  "availability_status": "available",
  "history": [
    {
      "date": "2026-08-17",
      "action": "created",
      "note": "Created for private mixed-source calibration; identifiers remain stable."
    }
  ],
  "homepage_eligible": true,
  "archive_date": null,
  "captured_fixture": true
}
