{
  "cluster_id": "ccc-multilayered-urban-forests",
  "slug": "multilayered-urban-forests",
  "public_title": "Multi-layered Urban Forests: can a City be dense and green?",
  "discussion_statement": "The paper discusses how urban density and layered urban forest design can be considered together rather than treated as mutually exclusive planning goals.",
  "date_first_observed": "2026-08-10",
  "date_most_recently_observed": "2026-08-10",
  "principal_source_id": "ccs-multilayered-urban-forests",
  "linked_source_ids": [],
  "primary_theme": "consequences-for-people-and-places",
  "secondary_themes": [],
  "geographies": [
    "global"
  ],
  "source_environments": [
    "academic-research"
  ],
  "principal_source_role": "primary-research",
  "summary": "The paper discusses how urban density and layered urban forest design can be considered together rather than treated as mutually exclusive planning goals.",
  "reason_for_relevance": "It illustrates place-based trade-offs among urban form, greenery, biodiversity and heat-related benefits.",
  "limitations": "The annotation uses abstract evidence and does not independently evaluate the design proposals.",
  "agreement_disagreement_uncertainty": "No source disagreement was established by the captured evidence.",
  "clustering": {
    "confidence": 1.0,
    "rationale": "Single-source cluster.",
    "method": "stable-link-and-event-identity",
    "version": "1.0.0",
    "supporting_identifiers": [
      "https://doi.org/10.3389/frsc.2026.1842594"
    ],
    "principal_source_rationale": "The original evidence or official source is principal; reporting, analysis and commentary remain separately attributed."
  },
  "ai_provenance": {
    "used": false,
    "model": null,
    "prompt_version": "current-conversations-classification-v1-fixture",
    "run_id": "thematic-reframe-mixed-source-captured"
  },
  "publication_decision": "published",
  "correction_status": "none",
  "availability_status": "available",
  "history": [
    {
      "date": "2026-08-17",
      "action": "created",
      "note": "Created for private mixed-source calibration; identifiers remain stable."
    }
  ],
  "homepage_eligible": true,
  "archive_date": null,
  "captured_fixture": false
}
