{
  "cluster_id": "ccc-local-capacity-policy-evaluation",
  "slug": "local-capacity-policy-evaluation",
  "public_title": "Local capacity building and policy evaluation in climate and environmental governance",
  "discussion_statement": "The paper examines how local capacity building and policy evaluation shape climate and environmental governance, using Mexico City as a case through which to discuss urban transformation.",
  "date_first_observed": "2026-08-14",
  "date_most_recently_observed": "2026-08-14",
  "principal_source_id": "ccs-local-capacity-policy-evaluation",
  "linked_source_ids": [],
  "primary_theme": "urban-climate-learning",
  "secondary_themes": [],
  "geographies": [
    "global"
  ],
  "source_environments": [
    "academic-research"
  ],
  "principal_source_role": "primary-research",
  "summary": "The paper examines how local capacity building and policy evaluation shape climate and environmental governance, using Mexico City as a case through which to discuss urban transformation.",
  "reason_for_relevance": "It connects directly to how cities build the institutional capacity needed to interpret evidence and sustain climate action.",
  "limitations": "The captured OpenAlex abstract was available; the full analysis was not independently reproduced.",
  "agreement_disagreement_uncertainty": "No source disagreement was established by the captured evidence.",
  "clustering": {
    "confidence": 1.0,
    "rationale": "Single-source cluster.",
    "method": "stable-link-and-event-identity",
    "version": "1.0.0",
    "supporting_identifiers": [
      "https://doi.org/10.1007/s44327-026-00345-6"
    ],
    "principal_source_rationale": "The original evidence or official source is principal; reporting, analysis and commentary remain separately attributed."
  },
  "ai_provenance": {
    "used": false,
    "model": null,
    "prompt_version": "current-conversations-classification-v1-fixture",
    "run_id": "gate-4b-5a-mixed-source-captured"
  },
  "publication_decision": "published",
  "correction_status": "none",
  "availability_status": "available",
  "history": [
    {
      "date": "2026-08-17",
      "action": "created",
      "note": "Created for private mixed-source calibration; identifiers remain stable."
    }
  ],
  "homepage_eligible": true,
  "archive_date": null,
  "captured_fixture": false
}
