{
  "cluster_id": "ccc-maritime-workforce-skills",
  "slug": "maritime-workforce-skills",
  "public_title": "Preparing the maritime workforce for the twin transition: skill priorities and educational needs",
  "discussion_statement": "The study investigates skill priorities and education needs created by the maritime sector's linked decarbonisation and digital transitions.",
  "date_first_observed": "2026-07-24",
  "date_most_recently_observed": "2026-07-24",
  "principal_source_id": "ccs-maritime-workforce-skills",
  "linked_source_ids": [],
  "primary_theme": "consequences-for-people-and-places",
  "secondary_themes": [],
  "geographies": [
    "global"
  ],
  "source_environments": [
    "academic-research"
  ],
  "principal_source_role": "primary-research",
  "summary": "The study investigates skill priorities and education needs created by the maritime sector's linked decarbonisation and digital transitions.",
  "reason_for_relevance": "It offers a sectoral example of how climate delivery changes occupational requirements and training needs.",
  "limitations": "Urban implications are indirect and should be assessed during owner calibration.",
  "agreement_disagreement_uncertainty": "No source disagreement was established by the captured evidence.",
  "clustering": {
    "confidence": 1.0,
    "rationale": "Single-source cluster.",
    "method": "stable-link-and-event-identity",
    "version": "1.0.0",
    "supporting_identifiers": [
      "https://doi.org/10.3389/frevc.2026.1887750"
    ],
    "principal_source_rationale": "The original evidence or official source is principal; reporting, analysis and commentary remain separately attributed."
  },
  "ai_provenance": {
    "used": false,
    "model": null,
    "prompt_version": "current-conversations-classification-v1-fixture",
    "run_id": "gate-5c-mixed-source-captured"
  },
  "publication_decision": "published",
  "correction_status": "none",
  "availability_status": "available",
  "history": [
    {
      "date": "2026-08-17",
      "action": "created",
      "note": "Created for private mixed-source calibration; identifiers remain stable."
    }
  ],
  "homepage_eligible": true,
  "archive_date": null,
  "captured_fixture": false
}
