{
  "cluster_id": "ccc-green-transition-justice",
  "slug": "green-transition-justice",
  "public_title": "Social Impacts of the Green Transition: Prospective Environmental (In)Justice in Europe's Peripheries",
  "discussion_statement": "Using six case studies, the article considers prospective environmental injustice associated with decarbonisation, critical minerals, regional strategies and gaps between workforce and socio-ecological policy.",
  "date_first_observed": "2026-08-13",
  "date_most_recently_observed": "2026-08-13",
  "principal_source_id": "ccs-green-transition-justice",
  "linked_source_ids": [],
  "primary_theme": "just-transitions-workforce",
  "secondary_themes": [],
  "geographies": [
    "europe"
  ],
  "source_environments": [
    "academic-research"
  ],
  "principal_source_role": "primary-research",
  "summary": "Using six case studies, the article considers prospective environmental injustice associated with decarbonisation, critical minerals, regional strategies and gaps between workforce and socio-ecological policy.",
  "reason_for_relevance": "It speaks to how transition benefits and burdens are governed across places and labour-market strategies.",
  "limitations": "The captured abstract supports a high-level description but not a case-by-case assessment.",
  "agreement_disagreement_uncertainty": "No source disagreement was established by the captured evidence.",
  "clustering": {
    "confidence": 1.0,
    "rationale": "Single-source cluster.",
    "method": "stable-link-and-event-identity",
    "version": "1.0.0",
    "supporting_identifiers": [
      "https://doi.org/10.17645/pag.12268"
    ],
    "principal_source_rationale": "The original evidence or official source is principal; reporting, analysis and commentary remain separately attributed."
  },
  "ai_provenance": {
    "used": false,
    "model": null,
    "prompt_version": "current-conversations-classification-v1-fixture",
    "run_id": "gate-4b-5a-mixed-source-captured"
  },
  "publication_decision": "published",
  "correction_status": "none",
  "availability_status": "available",
  "history": [
    {
      "date": "2026-08-17",
      "action": "created",
      "note": "Created for private mixed-source calibration; identifiers remain stable."
    }
  ],
  "homepage_eligible": true,
  "archive_date": null,
  "captured_fixture": false
}
