{
  "cluster_id": "ccc-sustainable-urban-data-centres",
  "slug": "sustainable-urban-data-centres",
  "public_title": "Mayors from around the world unite in call for sustainable urban data centres",
  "discussion_statement": "C40 describes a pact through which participating mayors seek to shape urban data-centre growth around energy, water, land, cost and community concerns.",
  "date_first_observed": "2026-06-23",
  "date_most_recently_observed": "2026-06-23",
  "principal_source_id": "ccs-c40-data-centres-pact",
  "linked_source_ids": [
    "ccs-ap-data-centres-reporting"
  ],
  "primary_theme": "modes-of-climate-delivery",
  "secondary_themes": [
    "consequences-for-people-and-places"
  ],
  "geographies": [
    "global"
  ],
  "source_environments": [
    "policy-and-institutions",
    "news-and-analysis"
  ],
  "principal_source_role": "official-announcement",
  "summary": "C40 describes a pact through which participating mayors seek to shape urban data-centre growth around energy, water, land, cost and community concerns.",
  "reason_for_relevance": "The pact illustrates collective city governance of a fast-growing infrastructure challenge with climate and distributional implications.",
  "limitations": "This official announcement predates the 30-day window and does not verify implementation by signatory cities.",
  "agreement_disagreement_uncertainty": "The official announcement states the commitment; reporting adds context without independently verifying implementation.",
  "clustering": {
    "confidence": 0.98,
    "rationale": "The reporting links directly to the named official pact.",
    "method": "stable-link-and-event-identity",
    "version": "1.0.0",
    "supporting_identifiers": [
      "https://www.c40.org/news/mayors-from-around-the-world-unite-in-call-for-sustainable-urban-data-centres/",
      "https://apnews.com/article/37df5184ad4f28ea084082563182e1ea"
    ],
    "principal_source_rationale": "The original evidence or official source is principal; reporting, analysis and commentary remain separately attributed."
  },
  "ai_provenance": {
    "used": false,
    "model": null,
    "prompt_version": "current-conversations-classification-v1-fixture",
    "run_id": "thematic-reframe-mixed-source-captured"
  },
  "publication_decision": "published",
  "correction_status": "none",
  "availability_status": "available",
  "history": [
    {
      "date": "2026-08-17",
      "action": "created",
      "note": "Created for private mixed-source calibration; identifiers remain stable."
    }
  ],
  "homepage_eligible": true,
  "archive_date": null,
  "captured_fixture": true
}
